{
  "$schema": "./schemas/blueprint.schema.json",
  "version": "1",
  "app": {
    "name": "RestA Design System",
    "domain": "website",
    "lang": "en"
  },
  "brand": {
    "primary": "hsl(346 77% 50%)",
    "accent": "hsl(346 80% 92%)",
    "font": "\"Nunito\", sans-serif"
  },
  "entities": [
    {
      "name": "colors",
      "singular": "Color",
      "fixture": "fixtures/colors.json",
      "fixtureType": "ColorsFixture",
      "itemsKey": "groups",
      "slugField": "id",
      "types": "src/types/colors.ts",
      "routes": ["/colors"],
      "views": ["src/blocks/colors/PageView.tsx"],
      "routeFiles": ["src/routes/colors/Page.tsx"]
    },
    {
      "name": "components",
      "singular": "Component",
      "fixture": "fixtures/components.json",
      "fixtureType": "ComponentsFixture",
      "itemsKey": "iconSamples",
      "slugField": "icon",
      "types": "src/types/components.ts",
      "routes": ["/components"],
      "views": ["src/blocks/components/PageView.tsx"],
      "routeFiles": ["src/routes/components/Page.tsx"]
    },
    {
      "name": "pages",
      "singular": "Page",
      "fixture": "fixtures/pages.json",
      "fixtureType": "DesignSectionFixture",
      "itemsKey": "items",
      "slugField": "slug",
      "types": "src/types/pages.ts",
      "routes": ["/pages"],
      "views": ["src/blocks/pages/PageView.tsx"],
      "routeFiles": ["src/routes/pages/Page.tsx"]
    },
    {
      "name": "primitives",
      "singular": "Primitive",
      "fixture": "fixtures/primitives.json",
      "fixtureType": "DesignSectionFixture",
      "itemsKey": "items",
      "slugField": "slug",
      "types": "src/types/primitives.ts",
      "routes": ["/primitives"],
      "views": ["src/blocks/primitives/PageView.tsx"],
      "routeFiles": ["src/routes/primitives/Page.tsx"]
    },
    {
      "name": "tokens",
      "singular": "Token",
      "fixture": "fixtures/tokens.json",
      "fixtureType": "DesignSectionFixture",
      "itemsKey": "items",
      "slugField": "slug",
      "types": "src/types/tokens.ts",
      "routes": ["/tokens"],
      "views": ["src/blocks/tokens/PageView.tsx"],
      "routeFiles": ["src/routes/tokens/Page.tsx"]
    },
    {
      "name": "typography",
      "singular": "Typography",
      "fixture": "fixtures/typography.json",
      "fixtureType": "DesignSectionFixture",
      "itemsKey": "items",
      "slugField": "slug",
      "types": "src/types/typography.ts",
      "routes": ["/typography"],
      "views": ["src/blocks/typography/PageView.tsx"],
      "routeFiles": ["src/routes/typography/Page.tsx"]
    },
    {
      "name": "widgets",
      "singular": "Widget",
      "fixture": "fixtures/widgets.json",
      "fixtureType": "DesignSectionFixture",
      "itemsKey": "items",
      "slugField": "slug",
      "types": "src/types/widgets.ts",
      "routes": ["/widgets"],
      "views": ["src/blocks/widgets/PageView.tsx"],
      "routeFiles": ["src/routes/widgets/Page.tsx"]
    }
  ],
  "layouts": [
    {
      "name": "DesignLayout",
      "file": "src/layouts/DesignLayout.tsx"
    }
  ],
  "partials": [
    {
      "name": "DesignHeader",
      "file": "src/partials/DesignHeader.tsx"
    },
    {
      "name": "DomainNavButton",
      "file": "src/partials/DomainNavButton.tsx"
    },
    {
      "name": "Sidebar",
      "file": "src/partials/Sidebar.tsx"
    },
    {
      "name": "ThemeToggle",
      "file": "src/partials/ThemeToggle.tsx"
    }
  ],
  "components": {
    "index": "src/components/index.ts",
    "count": 17
  },
  "navigation": {
    "source": "fixtures/shared/navigation.json",
    "type": "src/types/navigation.ts"
  },
  "context": {
    "file": "src/data/context.ts",
    "adapter": "src/data/adapters/fixtures.adapter.ts"
  },
  "domains": ["website"]
}
